### ISSUE TITLE
Reverting the nPrint file into PCAP 

### ISSUE THREAD

**Issue by ramonfontes** [nprint/nprint#3]
Hi,

I think that [#L125](https://github.com/nprint/nprint/blob/a2db222361eb2dfbab8e776757d528ab0229b0bc/src/nprint.cpp#L125) and [#L133](https://github.com/nprint/nprint/blob/a2db222361eb2dfbab8e776757d528ab0229b0bc/src/nprint.cpp#L133) won't work if we provide additional characters (e.g. csva, pcapa, etc) in `config.infile`. It seems that the patch below works better:

```
+ bool has_suffix(const std::string &str, const std::string &suffix)
+ {
+    return str.size() >= suffix.size() &&
+           str.compare(str.size() - suffix.size(), suffix.size(), suffix) == 0;
+ }

...
...

+if(has_suffix(config.infile, ".pcap"))
-if(std::string(config.infile).find(".pcap") != std::string::npos)

...
...

+else if(has_suffix(config.infile, ".csv"))
-else if(std::string(config.infile).find(".csv") != std::string::npos)
```

Btw, I was wondering if we should pass `config.infile` or `config.outfile`. I cannot take the nPrint file and reverse it into a PCAP file - `Libpcap` throws a segmentation fault. Is there a specific `libpcap` version I should care about?

**Comment by JordanHolland** [comment]
I have opened #4 for fixing command line argument parsing: it requires a bit more verbose usage,, but removes any trouble regarding file naming. Will address today.

the nPrint file is taken with -r, and must be combined with -w to write to a `pcap` file. The reverse option is the newest option implemented, so there may simply be a bug. What is your `libpcap` version, and what type of traffic are you trying to reverse? An example command for reversal to make sure this isn't the issue.

`$ nprint -r traffic.npt -z -w rebuilt-traffic.pcap`

**Comment by JordanHolland** [comment]
I've closed #4, the new command should be:

`$ nprint -N traffic.npt -w rebuilt-traffic.pcap`

Let me know if you have any issues.

**Comment by ramonfontes** [comment]
Hi, thanks for the follow up.

`nprint -N traffic.npt -w rebuilt-traffic.pcap` works but the pcap file is empty.

I've generated the npt file with `nprint -i -w test.npt -f icmp`

**Comment by JordanHolland** [comment]
Interesting. Does the nPrint have traffic in it? If so, Would you mind posting say, the first 5-10 lines here so that I can run locally?

**Comment by ramonfontes** [comment]
Yes, for sure.

```
ip,ipv4_ver_0,ipv4_ver_1,ipv4_ver_2,ipv4_ver_3,ipv4_hl_0,ipv4_hl_1,ipv4_hl_2,ipv4_hl_3,ipv4_tos_0,ipv4_tos_1,ipv4_tos_2,ipv4_tos_3,ipv4_tos_4,ipv4_tos_5,ipv4_tos_6,ipv4_tos_7,ipv4_tl_0,ipv4_tl_1,ipv4_tl_2,ipv4_tl_3,ipv4_tl_4,ipv4_tl_5,ipv4_tl_6,ipv4_tl_7,ipv4_tl_8,ipv4_tl_9,ipv4_tl_10,ipv4_tl_11,ipv4_tl_12,ipv4_tl_13,ipv4_tl_14,ipv4_tl_15,ipv4_id_0,ipv4_id_1,ipv4_id_2,ipv4_id_3,ipv4_id_4,ipv4_id_5,ipv4_id_6,ipv4_id_7,ipv4_id_8,ipv4_id_9,ipv4_id_10,ipv4_id_11,ipv4_id_12,ipv4_id_13,ipv4_id_14,ipv4_id_15,ipv4_rbit_0,ipv4_dfbit_0,ipv4_mfbit_0,ipv4_foff_0,ipv4_foff_1,ipv4_foff_2,ipv4_foff_3,ipv4_foff_4,ipv4_foff_5,ipv4_foff_6,ipv4_foff_7,ipv4_foff_8,ipv4_foff_9,ipv4_foff_10,ipv4_foff_11,ipv4_foff_12,ipv4_ttl_0,ipv4_ttl_1,ipv4_ttl_2,ipv4_ttl_3,ipv4_ttl_4,ipv4_ttl_5,ipv4_ttl_6,ipv4_ttl_7,ipv4_proto_0,ipv4_proto_1,ipv4_proto_2,ipv4_proto_3,ipv4_proto_4,ipv4_proto_5,ipv4_proto_6,ipv4_proto_7,ipv4_cksum_0,ipv4_cksum_1,ipv4_cksum_2,ipv4_cksum_3,ipv4_cksum_4,ipv4_cksum_5,ipv4_cksum_6,ipv4_cksum_7,ipv4_cksum_8,ipv4_cksum_9,ipv4_cksum_10,ipv4_cksum_11,ipv4_cksum_12,ipv4_cksum_13,ipv4_cksum_14,ipv4_cksum_15,ipv4_src_0,ipv4_src_1,ipv4_src_2,ipv4_src_3,ipv4_src_4,ipv4_src_5,ipv4_src_6,ipv4_src_7,ipv4_src_8,ipv4_src_9,ipv4_src_10,ipv4_src_11,ipv4_src_12,ipv4_src_13,ipv4_src_14,ipv4_src_15,ipv4_src_16,ipv4_src_17,ipv4_src_18,ipv4_src_19,ipv4_src_20,ipv4_src_21,ipv4_src_22,ipv4_src_23,ipv4_src_24,ipv4_src_25,ipv4_src_26,ipv4_src_27,ipv4_src_28,ipv4_src_29,ipv4_src_30,ipv4_src_31,ipv4_dst_0,ipv4_dst_1,ipv4_dst_2,ipv4_dst_3,ipv4_dst_4,ipv4_dst_5,ipv4_dst_6,ipv4_dst_7,ipv4_dst_8,ipv4_dst_9,ipv4_dst_10,ipv4_dst_11,ipv4_dst_12,ipv4_dst_13,ipv4_dst_14,ipv4_dst_15,ipv4_dst_16,ipv4_dst_17,ipv4_dst_18,ipv4_dst_19,ipv4_dst_20,ipv4_dst_21,ipv4_dst_22,ipv4_dst_23,ipv4_dst_24,ipv4_dst_25,ipv4_dst_26,ipv4_dst_27,ipv4_dst_28,ipv4_dst_29,ipv4_dst_30,ipv4_dst_31,ipv4_opt_0,ipv4_opt_1,ipv4_opt_2,ipv4_opt_3,ipv4_opt_4,ipv4_opt_5,ipv4_opt_6,ipv4_opt_7,ipv4_opt_8,ipv4_opt_9,ipv4_opt_10,ipv4_opt_11,ipv4_opt_12,ipv4_opt_13,ipv4_opt_14,ipv4_opt_15,ipv4_opt_16,ipv4_opt_17,ipv4_opt_18,ipv4_opt_19,ipv4_opt_20,ipv4_opt_21,ipv4_opt_22,ipv4_opt_23,ipv4_opt_24,ipv4_opt_25,ipv4_opt_26,ipv4_opt_27,ipv4_opt_28,ipv4_opt_29,ipv4_opt_30,ipv4_opt_31,ipv4_opt_32,ipv4_opt_33,ipv4_opt_34,ipv4_opt_35,ipv4_opt_36,ipv4_opt_37,ipv4_opt_38,ipv4_opt_39,ipv4_opt_40,ipv4_opt_41,ipv4_opt_42,ipv4_opt_43,ipv4_opt_44,ipv4_opt_45,ipv4_opt_46,ipv4_opt_47,ipv4_opt_48,ipv4_opt_49,ipv4_opt_50,ipv4_opt_51,ipv4_opt_52,ipv4_opt_53,ipv4_opt_54,ipv4_opt_55,ipv4_opt_56,ipv4_opt_57,ipv4_opt_58,ipv4_opt_59,ipv4_opt_60,ipv4_opt_61,ipv4_opt_62,ipv4_opt_63,ipv4_opt_64,ipv4_opt_65,ipv4_opt_66,ipv4_opt_67,ipv4_opt_68,ipv4_opt_69,ipv4_opt_70,ipv4_opt_71,ipv4_opt_72,ipv4_opt_73,ipv4_opt_74,ipv4_opt_75,ipv4_opt_76,ipv4_opt_77,ipv4_opt_78,ipv4_opt_79,ipv4_opt_80,ipv4_opt_81,ipv4_opt_82,ipv4_opt_83,ipv4_opt_84,ipv4_opt_85,ipv4_opt_86,ipv4_opt_87,ipv4_opt_88,ipv4_opt_89,ipv4_opt_90,ipv4_opt_91,ipv4_opt_92,ipv4_opt_93,ipv4_opt_94,ipv4_opt_95,ipv4_opt_96,ipv4_opt_97,ipv4_opt_98,ipv4_opt_99,ipv4_opt_100,ipv4_opt_101,ipv4_opt_102,ipv4_opt_103,ipv4_opt_104,ipv4_opt_105,ipv4_opt_106,ipv4_opt_107,ipv4_opt_108,ipv4_opt_109,ipv4_opt_110,ipv4_opt_111,ipv4_opt_112,ipv4_opt_113,ipv4_opt_114,ipv4_opt_115,ipv4_opt_116,ipv4_opt_117,ipv4_opt_118,ipv4_opt_119,ipv4_opt_120,ipv4_opt_121,ipv4_opt_122,ipv4_opt_123,ipv4_opt_124,ipv4_opt_125,ipv4_opt_126,ipv4_opt_127,ipv4_opt_128,ipv4_opt_129,ipv4_opt_130,ipv4_opt_131,ipv4_opt_132,ipv4_opt_133,ipv4_opt_134,ipv4_opt_135,ipv4_opt_136,ipv4_opt_137,ipv4_opt_138,ipv4_opt_139,ipv4_opt_140,ipv4_opt_141,ipv4_opt_142,ipv4_opt_143,ipv4_opt_144,ipv4_opt_145,ipv4_opt_146,ipv4_opt_147,ipv4_opt_148,ipv4_opt_149,ipv4_opt_150,ipv4_opt_151,ipv4_opt_152,ipv4_opt_153,ipv4_opt_154,ipv4_opt_155,ipv4_opt_156,ipv4_opt_157,ipv4_opt_158,ipv4_opt_159,ipv4_opt_160,ipv4_opt_161,ipv4_opt_162,ipv4_opt_163,ipv4_opt_164,ipv4_opt_165,ipv4_opt_166,ipv4_opt_167,ipv4_opt_168,ipv4_opt_169,ipv4_opt_170,ipv4_opt_171,ipv4_opt_172,ipv4_opt_173,ipv4_opt_174,ipv4_opt_175,ipv4_opt_176,ipv4_opt_177,ipv4_opt_178,ipv4_opt_179,ipv4_opt_180,ipv4_opt_181,ipv4_opt_182,ipv4_opt_183,ipv4_opt_184,ipv4_opt_185,ipv4_opt_186,ipv4_opt_187,ipv4_opt_188,ipv4_opt_189,ipv4_opt_190,ipv4_opt_191,ipv4_opt_192,ipv4_opt_193,ipv4_opt_194,ipv4_opt_195,ipv4_opt_196,ipv4_opt_197,ipv4_opt_198,ipv4_opt_199,ipv4_opt_200,ipv4_opt_201,ipv4_opt_202,ipv4_opt_203,ipv4_opt_204,ipv4_opt_205,ipv4_opt_206,ipv4_opt_207,ipv4_opt_208,ipv4_opt_209,ipv4_opt_210,ipv4_opt_211,ipv4_opt_212,ipv4_opt_213,ipv4_opt_214,ipv4_opt_215,ipv4_opt_216,ipv4_opt_217,ipv4_opt_218,ipv4_opt_219,ipv4_opt_220,ipv4_opt_221,ipv4_opt_222,ipv4_opt_223,ipv4_opt_224,ipv4_opt_225,ipv4_opt_226,ipv4_opt_227,ipv4_opt_228,ipv4_opt_229,ipv4_opt_230,ipv4_opt_231,ipv4_opt_232,ipv4_opt_233,ipv4_opt_234,ipv4_opt_235,ipv4_opt_236,ipv4_opt_237,ipv4_opt_238,ipv4_opt_239,ipv4_opt_240,ipv4_opt_241,ipv4_opt_242,ipv4_opt_243,ipv4_opt_244,ipv4_opt_245,ipv4_opt_246,ipv4_opt_247,ipv4_opt_248,ipv4_opt_249,ipv4_opt_250,ipv4_opt_251,ipv4_opt_252,ipv4_opt_253,ipv4_opt_254,ipv4_opt_255,ipv4_opt_256,ipv4_opt_257,ipv4_opt_258,ipv4_opt_259,ipv4_opt_260,ipv4_opt_261,ipv4_opt_262,ipv4_opt_263,ipv4_opt_264,ipv4_opt_265,ipv4_opt_266,ipv4_opt_267,ipv4_opt_268,ipv4_opt_269,ipv4_opt_270,ipv4_opt_271,ipv4_opt_272,ipv4_opt_273,ipv4_opt_274,ipv4_opt_275,ipv4_opt_276,ipv4_opt_277,ipv4_opt_278,ipv4_opt_279,ipv4_opt_280,ipv4_opt_281,ipv4_opt_282,ipv4_opt_283,ipv4_opt_284,ipv4_opt_285,ipv4_opt_286,ipv4_opt_287,ipv4_opt_288,ipv4_opt_289,ipv4_opt_290,ipv4_opt_291,ipv4_opt_292,ipv4_opt_293,ipv4_opt_294,ipv4_opt_295,ipv4_opt_296,ipv4_opt_297,ipv4_opt_298,ipv4_opt_299,ipv4_opt_300,ipv4_opt_301,ipv4_opt_302,ipv4_opt_303,ipv4_opt_304,ipv4_opt_305,ipv4_opt_306,ipv4_opt_307,ipv4_opt_308,ipv4_opt_309,ipv4_opt_310,ipv4_opt_311,ipv4_opt_312,ipv4_opt_313,ipv4_opt_314,ipv4_opt_315,ipv4_opt_316,ipv4_opt_317,ipv4_opt_318,ipv4_opt_319,tcp_sprt_0,tcp_sprt_1,tcp_sprt_2,tcp_sprt_3,tcp_sprt_4,tcp_sprt_5,tcp_sprt_6,tcp_sprt_7,tcp_sprt_8,tcp_sprt_9,tcp_sprt_10,tcp_sprt_11,tcp_sprt_12,tcp_sprt_13,tcp_sprt_14,tcp_sprt_15,tcp_dprt_0,tcp_dprt_1,tcp_dprt_2,tcp_dprt_3,tcp_dprt_4,tcp_dprt_5,tcp_dprt_6,tcp_dprt_7,tcp_dprt_8,tcp_dprt_9,tcp_dprt_10,tcp_dprt_11,tcp_dprt_12,tcp_dprt_13,tcp_dprt_14,tcp_dprt_15,tcp_seq_0,tcp_seq_1,tcp_seq_2,tcp_seq_3,tcp_seq_4,tcp_seq_5,tcp_seq_6,tcp_seq_7,tcp_seq_8,tcp_seq_9,tcp_seq_10,tcp_seq_11,tcp_seq_12,tcp_seq_13,tcp_seq_14,tcp_seq_15,tcp_seq_16,tcp_seq_17,tcp_seq_18,tcp_seq_19,tcp_seq_20,tcp_seq_21,tcp_seq_22,tcp_seq_23,tcp_seq_24,tcp_seq_25,tcp_seq_26,tcp_seq_27,tcp_seq_28,tcp_seq_29,tcp_seq_30,tcp_seq_31,tcp_ackn_0,tcp_ackn_1,tcp_ackn_2,tcp_ackn_3,tcp_ackn_4,tcp_ackn_5,tcp_ackn_6,tcp_ackn_7,tcp_ackn_8,tcp_ackn_9,tcp_ackn_10,tcp_ackn_11,tcp_ackn_12,tcp_ackn_13,tcp_ackn_14,tcp_ackn_15,tcp_ackn_16,tcp_ackn_17,tcp_ackn_18,tcp_ackn_19,tcp_ackn_20,tcp_ackn_21,tcp_ackn_22,tcp_ackn_23,tcp_ackn_24,tcp_ackn_25,tcp_ackn_26,tcp_ackn_27,tcp_ackn_28,tcp_ackn_29,tcp_ackn_30,tcp_ackn_31,tcp_doff_0,tcp_doff_1,tcp_doff_2,tcp_doff_3,tcp_res_0,tcp_res_1,tcp_res_2,tcp_ns_0,tcp_cwr_0,tcp_ece_0,tcp_urg_0,tcp_ackf_0,tcp_psh_0,tcp_rst_0,tcp_syn_0,tcp_fin_0,tcp_wsize_0,tcp_wsize_1,tcp_wsize_2,tcp_wsize_3,tcp_wsize_4,tcp_wsize_5,tcp_wsize_6,tcp_wsize_7,tcp_wsize_8,tcp_wsize_9,tcp_wsize_10,tcp_wsize_11,tcp_wsize_12,tcp_wsize_13,tcp_wsize_14,tcp_wsize_15,tcp_cksum_0,tcp_cksum_1,tcp_cksum_2,tcp_cksum_3,tcp_cksum_4,tcp_cksum_5,tcp_cksum_6,tcp_cksum_7,tcp_cksum_8,tcp_cksum_9,tcp_cksum_10,tcp_cksum_11,tcp_cksum_12,tcp_cksum_13,tcp_cksum_14,tcp_cksum_15,tcp_urp_0,tcp_urp_1,tcp_urp_2,tcp_urp_3,tcp_urp_4,tcp_urp_5,tcp_urp_6,tcp_urp_7,tcp_urp_8,tcp_urp_9,tcp_urp_10,tcp_urp_11,tcp_urp_12,tcp_urp_13,tcp_urp_14,tcp_urp_15,tcp_opt_0,tcp_opt_1,tcp_opt_2,tcp_opt_3,tcp_opt_4,tcp_opt_5,tcp_opt_6,tcp_opt_7,tcp_opt_8,tcp_opt_9,tcp_opt_10,tcp_opt_11,tcp_opt_12,tcp_opt_13,tcp_opt_14,tcp_opt_15,tcp_opt_16,tcp_opt_17,tcp_opt_18,tcp_opt_19,tcp_opt_20,tcp_opt_21,tcp_opt_22,tcp_opt_23,tcp_opt_24,tcp_opt_25,tcp_opt_26,tcp_opt_27,tcp_opt_28,tcp_opt_29,tcp_opt_30,tcp_opt_31,tcp_opt_32,tcp_opt_33,tcp_opt_34,tcp_opt_35,tcp_opt_36,tcp_opt_37,tcp_opt_38,tcp_opt_39,tcp_opt_40,tcp_opt_41,tcp_opt_42,tcp_opt_43,tcp_opt_44,tcp_opt_45,tcp_opt_46,tcp_opt_47,tcp_opt_48,tcp_opt_49,tcp_opt_50,tcp_opt_51,tcp_opt_52,tcp_opt_53,tcp_opt_54,tcp_opt_55,tcp_opt_56,tcp_opt_57,tcp_opt_58,tcp_opt_59,tcp_opt_60,tcp_opt_61,tcp_opt_62,tcp_opt_63,tcp_opt_64,tcp_opt_65,tcp_opt_66,tcp_opt_67,tcp_opt_68,tcp_opt_69,tcp_opt_70,tcp_opt_71,tcp_opt_72,tcp_opt_73,tcp_opt_74,tcp_opt_75,tcp_opt_76,tcp_opt_77,tcp_opt_78,tcp_opt_79,tcp_opt_80,tcp_opt_81,tcp_opt_82,tcp_opt_83,tcp_opt_84,tcp_opt_85,tcp_opt_86,tcp_opt_87,tcp_opt_88,tcp_opt_89,tcp_opt_90,tcp_opt_91,tcp_opt_92,tcp_opt_93,tcp_opt_94,tcp_opt_95,tcp_opt_96,tcp_opt_97,tcp_opt_98,tcp_opt_99,tcp_opt_100,tcp_opt_101,tcp_opt_102,tcp_opt_103,tcp_opt_104,tcp_opt_105,tcp_opt_106,tcp_opt_107,tcp_opt_108,tcp_opt_109,tcp_opt_110,tcp_opt_111,tcp_opt_112,tcp_opt_113,tcp_opt_114,tcp_opt_115,tcp_opt_116,tcp_opt_117,tcp_opt_118,tcp_opt_119,tcp_opt_120,tcp_opt_121,tcp_opt_122,tcp_opt_123,tcp_opt_124,tcp_opt_125,tcp_opt_126,tcp_opt_127,tcp_opt_128,tcp_opt_129,tcp_opt_130,tcp_opt_131,tcp_opt_132,tcp_opt_133,tcp_opt_134,tcp_opt_135,tcp_opt_136,tcp_opt_137,tcp_opt_138,tcp_opt_139,tcp_opt_140,tcp_opt_141,tcp_opt_142,tcp_opt_143,tcp_opt_144,tcp_opt_145,tcp_opt_146,tcp_opt_147,tcp_opt_148,tcp_opt_149,tcp_opt_150,tcp_opt_151,tcp_opt_152,tcp_opt_153,tcp_opt_154,tcp_opt_155,tcp_opt_156,tcp_opt_157,tcp_opt_158,tcp_opt_159,tcp_opt_160,tcp_opt_161,tcp_opt_162,tcp_opt_163,tcp_opt_164,tcp_opt_165,tcp_opt_166,tcp_opt_167,tcp_opt_168,tcp_opt_169,tcp_opt_170,tcp_opt_171,tcp_opt_172,tcp_opt_173,tcp_opt_174,tcp_opt_175,tcp_opt_176,tcp_opt_177,tcp_opt_178,tcp_opt_179,tcp_opt_180,tcp_opt_181,tcp_opt_182,tcp_opt_183,tcp_opt_184,tcp_opt_185,tcp_opt_186,tcp_opt_187,tcp_opt_188,tcp_opt_189,tcp_opt_190,tcp_opt_191,tcp_opt_192,tcp_opt_193,tcp_opt_194,tcp_opt_195,tcp_opt_196,tcp_opt_197,tcp_opt_198,tcp_opt_199,tcp_opt_200,tcp_opt_201,tcp_opt_202,tcp_opt_203,tcp_opt_204,tcp_opt_205,tcp_opt_206,tcp_opt_207,tcp_opt_208,tcp_opt_209,tcp_opt_210,tcp_opt_211,tcp_opt_212,tcp_opt_213,tcp_opt_214,tcp_opt_215,tcp_opt_216,tcp_opt_217,tcp_opt_218,tcp_opt_219,tcp_opt_220,tcp_opt_221,tcp_opt_222,tcp_opt_223,tcp_opt_224,tcp_opt_225,tcp_opt_226,tcp_opt_227,tcp_opt_228,tcp_opt_229,tcp_opt_230,tcp_opt_231,tcp_opt_232,tcp_opt_233,tcp_opt_234,tcp_opt_235,tcp_opt_236,tcp_opt_237,tcp_opt_238,tcp_opt_239,tcp_opt_240,tcp_opt_241,tcp_opt_242,tcp_opt_243,tcp_opt_244,tcp_opt_245,tcp_opt_246,tcp_opt_247,tcp_opt_248,tcp_opt_249,tcp_opt_250,tcp_opt_251,tcp_opt_252,tcp_opt_253,tcp_opt_254,tcp_opt_255,tcp_opt_256,tcp_opt_257,tcp_opt_258,tcp_opt_259,tcp_opt_260,tcp_opt_261,tcp_opt_262,tcp_opt_263,tcp_opt_264,tcp_opt_265,tcp_opt_266,tcp_opt_267,tcp_opt_268,tcp_opt_269,tcp_opt_270,tcp_opt_271,tcp_opt_272,tcp_opt_273,tcp_opt_274,tcp_opt_275,tcp_opt_276,tcp_opt_277,tcp_opt_278,tcp_opt_279,tcp_opt_280,tcp_opt_281,tcp_opt_282,tcp_opt_283,tcp_opt_284,tcp_opt_285,tcp_opt_286,tcp_opt_287,tcp_opt_288,tcp_opt_289,tcp_opt_290,tcp_opt_291,tcp_opt_292,tcp_opt_293,tcp_opt_294,tcp_opt_295,tcp_opt_296,tcp_opt_297,tcp_opt_298,tcp_opt_299,tcp_opt_300,tcp_opt_301,tcp_opt_302,tcp_opt_303,tcp_opt_304,tcp_opt_305,tcp_opt_306,tcp_opt_307,tcp_opt_308,tcp_opt_309,tcp_opt_310,tcp_opt_311,tcp_opt_312,tcp_opt_313,tcp_opt_314,tcp_opt_315,tcp_opt_316,tcp_opt_317,tcp_opt_318,tcp_opt_319
10.0.0.2,0,1,0,0,0,1,0,1,0,0,0,0,0,0,0,0,0,0,0,0,0,0,0,0,0,1,0,1,0,1,0,0,0,0,0,1,0,0,1,0,1,0,0,0,0,1,0,0,0,1,0,0,0,0,0,0,0,0,0,0,0,0,0,0,0,1,0,0,0,0,0,0,0,0,0,0,0,0,0,1,0,0,0,1,0,1,0,0,0,0,1,0,0,0,1,1,0,0,0,0,1,0,1,0,0,0,0,0,0,0,0,0,0,0,0,0,0,0,0,0,0,0,0,0,0,0,1,0,0,0,0,0,1,0,1,0,0,0,0,0,0,0,0,0,0,0,0,0,0,0,0,0,0,0,0,0,0,0,0,1,-1,-1,-1,-1,-1,-1,-1,-1,-1,-1,-1,-1,-1,-1,-1,-1,-1,-1,-1,-1,-1,-1,-1,-1,-1,-1,-1,-1,-1,-1,-1,-1,-1,-1,-1,-1,-1,-1,-1,-1,-1,-1,-1,-1,-1,-1,-1,-1,-1,-1,-1,-1,-1,-1,-1,-1,-1,-1,-1,-1,-1,-1,-1,-1,-1,-1,-1,-1,-1,-1,-1,-1,-1,-1,-1,-1,-1,-1,-1,-1,-1,-1,-1,-1,-1,-1,-1,-1,-1,-1,-1,-1,-1,-1,-1,-1,-1,-1,-1,-1,-1,-1,-1,-1,-1,-1,-1,-1,-1,-1,-1,-1,-1,-1,-1,-1,-1,-1,-1,-1,-1,-1,-1,-1,-1,-1,-1,-1,-1,-1,-1,-1,-1,-1,-1,-1,-1,-1,-1,-1,-1,-1,-1,-1,-1,-1,-1,-1,-1,-1,-1,-1,-1,-1,-1,-1,-1,-1,-1,-1,-1,-1,-1,-1,-1,-1,-1,-1,-1,-1,-1,-1,-1,-1,-1,-1,-1,-1,-1,-1,-1,-1,-1,-1,-1,-1,-1,-1,-1,-1,-1,-1,-1,-1,-1,-1,-1,-1,-1,-1,-1,-1,-1,-1,-1,-1,-1,-1,-1,-1,-1,-1,-1,-1,-1,-1,-1,-1,-1,-1,-1,-1,-1,-1,-1,-1,-1,-1,-1,-1,-1,-1,-1,-1,-1,-1,-1,-1,-1,-1,-1,-1,-1,-1,-1,-1,-1,-1,-1,-1,-1,-1,-1,-1,-1,-1,-1,-1,-1,-1,-1,-1,-1,-1,-1,-1,-1,-1,-1,-1,-1,-1,-1,-1,-1,-1,-1,-1,-1,-1,-1,-1,-1,-1,-1,-1,-1,-1,-1,-1,-1,-1,-1,-1,-1,-1,-1,-1,-1,-1,-1,-1,-1,-1,-1,-1,-1,-1,-1,-1,-1,-1,-1,-1,-1,-1,-1,-1,-1,-1,-1,-1,-1,-1,-1,-1,-1,-1,-1,-1,-1,-1,-1,-1,-1,-1,-1,-1,-1,-1,-1,-1,-1,-1,-1,-1,-1,-1,-1,-1,-1,-1,-1,-1,-1,-1,-1,-1,-1,-1,-1,-1,-1,-1,-1,-1,-1,-1,-1,-1,-1,-1,-1,-1,-1,-1,-1,-1,-1,-1,-1,-1,-1,-1,-1,-1,-1,-1,-1,-1,-1,-1,-1,-1,-1,-1,-1,-1,-1,-1,-1,-1,-1,-1,-1,-1,-1,-1,-1,-1,-1,-1,-1,-1,-1,-1,-1,-1,-1,-1,-1,-1,-1,-1,-1,-1,-1,-1,-1,-1,-1,-1,-1,-1,-1,-1,-1,-1,-1,-1,-1,-1,-1,-1,-1,-1,-1,-1,-1,-1,-1,-1,-1,-1,-1,-1,-1,-1,-1,-1,-1,-1,-1,-1,-1,-1,-1,-1,-1,-1,-1,-1,-1,-1,-1,-1,-1,-1,-1,-1,-1,-1,-1,-1,-1,-1,-1,-1,-1,-1,-1,-1,-1,-1,-1,-1,-1,-1,-1,-1,-1,-1,-1,-1,-1,-1,-1,-1,-1,-1,-1,-1,-1,-1,-1,-1,-1,-1,-1,-1,-1,-1,-1,-1,-1,-1,-1,-1,-1,-1,-1,-1,-1,-1,-1,-1,-1,-1,-1,-1,-1,-1,-1,-1,-1,-1,-1,-1,-1,-1,-1,-1,-1,-1,-1,-1,-1,-1,-1,-1,-1,-1,-1,-1,-1,-1,-1,-1,-1,-1,-1,-1,-1,-1,-1,-1,-1,-1,-1,-1,-1,-1,-1,-1,-1,-1,-1,-1,-1,-1,-1,-1,-1,-1,-1,-1,-1,-1,-1,-1,-1,-1,-1,-1,-1,-1,-1,-1,-1,-1,-1,-1,-1,-1,-1,-1,-1,-1,-1,-1,-1,-1,-1,-1,-1,-1,-1,-1,-1,-1,-1,-1,-1,-1,-1,-1,-1,-1,-1,-1,-1,-1,-1,-1,-1,-1,-1,-1,-1,-1,-1,-1,-1,-1,-1,-1,-1,-1,-1,-1,-1,-1,-1,-1,-1,-1,-1,-1,-1,-1,-1,-1,-1,-1,-1,-1,-1,-1,-1,-1,-1,-1,-1,-1,-1,-1,-1,-1,-1,-1,-1,-1,-1,-1,-1,-1,-1,-1,-1,-1,-1,-1,-1,-1,-1,-1,-1,-1,-1,-1,-1,-1,-1,-1,-1,-1,-1,-1,-1,-1,-1,-1,-1,-1,-1,-1,-1,-1,-1,-1,-1,-1,-1,-1,-1,-1,-1,-1,-1,-1,-1,-1,-1,-1,-1,-1,-1,-1,-1,-1,-1,-1,-1,-1,-1,-1,-1,-1,-1,-1,-1,-1,-1,-1,-1,-1,-1,-1,-1,-1,-1,-1,-1,-1,-1,-1,-1,-1,-1,-1,-1,-1,-1,-1,-1,-1,-1,-1,-1,-1,-1,-1,-1,-1,-1,-1,-1,-1,-1,-1
10.0.0.1,0,1,0,0,0,1,0,1,0,0,0,0,0,0,0,0,0,0,0,0,0,0,0,0,0,1,0,1,0,1,0,0,1,0,1,1,1,1,0,1,0,1,0,0,0,0,1,1,0,0,0,0,0,0,0,0,0,0,0,0,0,0,0,0,0,1,0,0,0,0,0,0,0,0,0,0,0,0,0,1,1,0,1,0,1,0,0,1,0,1,1,0,0,0,1,1,0,0,0,0,1,0,1,0,0,0,0,0,0,0,0,0,0,0,0,0,0,0,0,0,0,0,0,0,0,0,0,1,0,0,0,0,1,0,1,0,0,0,0,0,0,0,0,0,0,0,0,0,0,0,0,0,0,0,0,0,0,0,1,0,-1,-1,-1,-1,-1,-1,-1,-1,-1,-1,-1,-1,-1,-1,-1,-1,-1,-1,-1,-1,-1,-1,-1,-1,-1,-1,-1,-1,-1,-1,-1,-1,-1,-1,-1,-1,-1,-1,-1,-1,-1,-1,-1,-1,-1,-1,-1,-1,-1,-1,-1,-1,-1,-1,-1,-1,-1,-1,-1,-1,-1,-1,-1,-1,-1,-1,-1,-1,-1,-1,-1,-1,-1,-1,-1,-1,-1,-1,-1,-1,-1,-1,-1,-1,-1,-1,-1,-1,-1,-1,-1,-1,-1,-1,-1,-1,-1,-1,-1,-1,-1,-1,-1,-1,-1,-1,-1,-1,-1,-1,-1,-1,-1,-1,-1,-1,-1,-1,-1,-1,-1,-1,-1,-1,-1,-1,-1,-1,-1,-1,-1,-1,-1,-1,-1,-1,-1,-1,-1,-1,-1,-1,-1,-1,-1,-1,-1,-1,-1,-1,-1,-1,-1,-1,-1,-1,-1,-1,-1,-1,-1,-1,-1,-1,-1,-1,-1,-1,-1,-1,-1,-1,-1,-1,-1,-1,-1,-1,-1,-1,-1,-1,-1,-1,-1,-1,-1,-1,-1,-1,-1,-1,-1,-1,-1,-1,-1,-1,-1,-1,-1,-1,-1,-1,-1,-1,-1,-1,-1,-1,-1,-1,-1,-1,-1,-1,-1,-1,-1,-1,-1,-1,-1,-1,-1,-1,-1,-1,-1,-1,-1,-1,-1,-1,-1,-1,-1,-1,-1,-1,-1,-1,-1,-1,-1,-1,-1,-1,-1,-1,-1,-1,-1,-1,-1,-1,-1,-1,-1,-1,-1,-1,-1,-1,-1,-1,-1,-1,-1,-1,-1,-1,-1,-1,-1,-1,-1,-1,-1,-1,-1,-1,-1,-1,-1,-1,-1,-1,-1,-1,-1,-1,-1,-1,-1,-1,-1,-1,-1,-1,-1,-1,-1,-1,-1,-1,-1,-1,-1,-1,-1,-1,-1,-1,-1,-1,-1,-1,-1,-1,-1,-1,-1,-1,-1,-1,-1,-1,-1,-1,-1,-1,-1,-1,-1,-1,-1,-1,-1,-1,-1,-1,-1,-1,-1,-1,-1,-1,-1,-1,-1,-1,-1,-1,-1,-1,-1,-1,-1,-1,-1,-1,-1,-1,-1,-1,-1,-1,-1,-1,-1,-1,-1,-1,-1,-1,-1,-1,-1,-1,-1,-1,-1,-1,-1,-1,-1,-1,-1,-1,-1,-1,-1,-1,-1,-1,-1,-1,-1,-1,-1,-1,-1,-1,-1,-1,-1,-1,-1,-1,-1,-1,-1,-1,-1,-1,-1,-1,-1,-1,-1,-1,-1,-1,-1,-1,-1,-1,-1,-1,-1,-1,-1,-1,-1,-1,-1,-1,-1,-1,-1,-1,-1,-1,-1,-1,-1,-1,-1,-1,-1,-1,-1,-1,-1,-1,-1,-1,-1,-1,-1,-1,-1,-1,-1,-1,-1,-1,-1,-1,-1,-1,-1,-1,-1,-1,-1,-1,-1,-1,-1,-1,-1,-1,-1,-1,-1,-1,-1,-1,-1,-1,-1,-1,-1,-1,-1,-1,-1,-1,-1,-1,-1,-1,-1,-1,-1,-1,-1,-1,-1,-1,-1,-1,-1,-1,-1,-1,-1,-1,-1,-1,-1,-1,-1,-1,-1,-1,-1,-1,-1,-1,-1,-1,-1,-1,-1,-1,-1,-1,-1,-1,-1,-1,-1,-1,-1,-1,-1,-1,-1,-1,-1,-1,-1,-1,-1,-1,-1,-1,-1,-1,-1,-1,-1,-1,-1,-1,-1,-1,-1,-1,-1,-1,-1,-1,-1,-1,-1,-1,-1,-1,-1,-1,-1,-1,-1,-1,-1,-1,-1,-1,-1,-1,-1,-1,-1,-1,-1,-1,-1,-1,-1,-1,-1,-1,-1,-1,-1,-1,-1,-1,-1,-1,-1,-1,-1,-1,-1,-1,-1,-1,-1,-1,-1,-1,-1,-1,-1,-1,-1,-1,-1,-1,-1,-1,-1,-1,-1,-1,-1,-1,-1,-1,-1,-1,-1,-1,-1,-1,-1,-1,-1,-1,-1,-1,-1,-1,-1,-1,-1,-1,-1,-1,-1,-1,-1,-1,-1,-1,-1,-1,-1,-1,-1,-1,-1,-1,-1,-1,-1,-1,-1,-1,-1,-1,-1,-1,-1,-1,-1,-1,-1,-1,-1,-1,-1,-1,-1,-1,-1,-1,-1,-1,-1,-1,-1,-1,-1,-1,-1,-1,-1,-1,-1,-1,-1,-1,-1,-1,-1,-1,-1,-1,-1,-1,-1,-1,-1,-1,-1,-1,-1,-1,-1,-1,-1,-1,-1,-1,-1,-1,-1,-1,-1,-1,-1,-1,-1,-1,-1,-1,-1,-1,-1,-1,-1,-1,-1,-1,-1,-1,-1,-1,-1,-1,-1,-1,-1,-1,-1,-1,-1,-1,-1,-1,-1,-1,-1,-1,-1,-1,-1,-1,-1,-1,-1,-1,-1,-1,-1,-1,-1,-1,-1,-1,-1,-1,-1,-1
10.0.0.2,0,1,0,0,0,1,0,1,0,0,0,0,0,0,0,0,0,0,0,0,0,0,0,0,0,1,0,1,0,1,0,0,0,0,0,1,0,0,1,1,0,0,1,0,1,0,1,1,0,1,0,0,0,0,0,0,0,0,0,0,0,0,0,0,0,1,0,0,0,0,0,0,0,0,0,0,0,0,0,1,0,0,0,1,0,0,1,1,0,1,1,1,1,1,0,0,0,0,0,0,1,0,1,0,0,0,0,0,0,0,0,0,0,0,0,0,0,0,0,0,0,0,0,0,0,0,1,0,0,0,0,0,1,0,1,0,0,0,0,0,0,0,0,0,0,0,0,0,0,0,0,0,0,0,0,0,0,0,0,1,-1,-1,-1,-1,-1,-1,-1,-1,-1,-1,-1,-1,-1,-1,-1,-1,-1,-1,-1,-1,-1,-1,-1,-1,-1,-1,-1,-1,-1,-1,-1,-1,-1,-1,-1,-1,-1,-1,-1,-1,-1,-1,-1,-1,-1,-1,-1,-1,-1,-1,-1,-1,-1,-1,-1,-1,-1,-1,-1,-1,-1,-1,-1,-1,-1,-1,-1,-1,-1,-1,-1,-1,-1,-1,-1,-1,-1,-1,-1,-1,-1,-1,-1,-1,-1,-1,-1,-1,-1,-1,-1,-1,-1,-1,-1,-1,-1,-1,-1,-1,-1,-1,-1,-1,-1,-1,-1,-1,-1,-1,-1,-1,-1,-1,-1,-1,-1,-1,-1,-1,-1,-1,-1,-1,-1,-1,-1,-1,-1,-1,-1,-1,-1,-1,-1,-1,-1,-1,-1,-1,-1,-1,-1,-1,-1,-1,-1,-1,-1,-1,-1,-1,-1,-1,-1,-1,-1,-1,-1,-1,-1,-1,-1,-1,-1,-1,-1,-1,-1,-1,-1,-1,-1,-1,-1,-1,-1,-1,-1,-1,-1,-1,-1,-1,-1,-1,-1,-1,-1,-1,-1,-1,-1,-1,-1,-1,-1,-1,-1,-1,-1,-1,-1,-1,-1,-1,-1,-1,-1,-1,-1,-1,-1,-1,-1,-1,-1,-1,-1,-1,-1,-1,-1,-1,-1,-1,-1,-1,-1,-1,-1,-1,-1,-1,-1,-1,-1,-1,-1,-1,-1,-1,-1,-1,-1,-1,-1,-1,-1,-1,-1,-1,-1,-1,-1,-1,-1,-1,-1,-1,-1,-1,-1,-1,-1,-1,-1,-1,-1,-1,-1,-1,-1,-1,-1,-1,-1,-1,-1,-1,-1,-1,-1,-1,-1,-1,-1,-1,-1,-1,-1,-1,-1,-1,-1,-1,-1,-1,-1,-1,-1,-1,-1,-1,-1,-1,-1,-1,-1,-1,-1,-1,-1,-1,-1,-1,-1,-1,-1,-1,-1,-1,-1,-1,-1,-1,-1,-1,-1,-1,-1,-1,-1,-1,-1,-1,-1,-1,-1,-1,-1,-1,-1,-1,-1,-1,-1,-1,-1,-1,-1,-1,-1,-1,-1,-1,-1,-1,-1,-1,-1,-1,-1,-1,-1,-1,-1,-1,-1,-1,-1,-1,-1,-1,-1,-1,-1,-1,-1,-1,-1,-1,-1,-1,-1,-1,-1,-1,-1,-1,-1,-1,-1,-1,-1,-1,-1,-1,-1,-1,-1,-1,-1,-1,-1,-1,-1,-1,-1,-1,-1,-1,-1,-1,-1,-1,-1,-1,-1,-1,-1,-1,-1,-1,-1,-1,-1,-1,-1,-1,-1,-1,-1,-1,-1,-1,-1,-1,-1,-1,-1,-1,-1,-1,-1,-1,-1,-1,-1,-1,-1,-1,-1,-1,-1,-1,-1,-1,-1,-1,-1,-1,-1,-1,-1,-1,-1,-1,-1,-1,-1,-1,-1,-1,-1,-1,-1,-1,-1,-1,-1,-1,-1,-1,-1,-1,-1,-1,-1,-1,-1,-1,-1,-1,-1,-1,-1,-1,-1,-1,-1,-1,-1,-1,-1,-1,-1,-1,-1,-1,-1,-1,-1,-1,-1,-1,-1,-1,-1,-1,-1,-1,-1,-1,-1,-1,-1,-1,-1,-1,-1,-1,-1,-1,-1,-1,-1,-1,-1,-1,-1,-1,-1,-1,-1,-1,-1,-1,-1,-1,-1,-1,-1,-1,-1,-1,-1,-1,-1,-1,-1,-1,-1,-1,-1,-1,-1,-1,-1,-1,-1,-1,-1,-1,-1,-1,-1,-1,-1,-1,-1,-1,-1,-1,-1,-1,-1,-1,-1,-1,-1,-1,-1,-1,-1,-1,-1,-1,-1,-1,-1,-1,-1,-1,-1,-1,-1,-1,-1,-1,-1,-1,-1,-1,-1,-1,-1,-1,-1,-1,-1,-1,-1,-1,-1,-1,-1,-1,-1,-1,-1,-1,-1,-1,-1,-1,-1,-1,-1,-1,-1,-1,-1,-1,-1,-1,-1,-1,-1,-1,-1,-1,-1,-1,-1,-1,-1,-1,-1,-1,-1,-1,-1,-1,-1,-1,-1,-1,-1,-1,-1,-1,-1,-1,-1,-1,-1,-1,-1,-1,-1,-1,-1,-1,-1,-1,-1,-1,-1,-1,-1,-1,-1,-1,-1,-1,-1,-1,-1,-1,-1,-1,-1,-1,-1,-1,-1,-1,-1,-1,-1,-1,-1,-1,-1,-1,-1,-1,-1,-1,-1,-1,-1,-1,-1,-1,-1,-1,-1,-1,-1,-1,-1,-1,-1,-1,-1,-1,-1,-1,-1,-1,-1,-1,-1,-1,-1,-1,-1,-1,-1,-1,-1,-1,-1,-1,-1,-1,-1,-1,-1,-1,-1,-1,-1,-1,-1,-1,-1,-1,-1,-1,-1,-1,-1,-1,-1,-1,-1,-1,-1,-1,-1,-1,-1,-1,-1,-1,-1,-1,-1,-1,-1,-1,-1,-1,-1,-1,-1,-1
10.0.0.1,0,1,0,0,0,1,0,1,0,0,0,0,0,0,0,0,0,0,0,0,0,0,0,0,0,1,0,1,0,1,0,0,1,0,1,1,1,1,0,1,1,1,1,1,1,1,1,1,0,0,0,0,0,0,0,0,0,0,0,0,0,0,0,0,0,1,0,0,0,0,0,0,0,0,0,0,0,0,0,1,1,0,1,0,1,0,0,0,1,0,1,0,0,1,1,1,0,0,0,0,1,0,1,0,0,0,0,0,0,0,0,0,0,0,0,0,0,0,0,0,0,0,0,0,0,0,0,1,0,0,0,0,1,0,1,0,0,0,0,0,0,0,0,0,0,0,0,0,0,0,0,0,0,0,0,0,0,0,1,0,-1,-1,-1,-1,-1,-1,-1,-1,-1,-1,-1,-1,-1,-1,-1,-1,-1,-1,-1,-1,-1,-1,-1,-1,-1,-1,-1,-1,-1,-1,-1,-1,-1,-1,-1,-1,-1,-1,-1,-1,-1,-1,-1,-1,-1,-1,-1,-1,-1,-1,-1,-1,-1,-1,-1,-1,-1,-1,-1,-1,-1,-1,-1,-1,-1,-1,-1,-1,-1,-1,-1,-1,-1,-1,-1,-1,-1,-1,-1,-1,-1,-1,-1,-1,-1,-1,-1,-1,-1,-1,-1,-1,-1,-1,-1,-1,-1,-1,-1,-1,-1,-1,-1,-1,-1,-1,-1,-1,-1,-1,-1,-1,-1,-1,-1,-1,-1,-1,-1,-1,-1,-1,-1,-1,-1,-1,-1,-1,-1,-1,-1,-1,-1,-1,-1,-1,-1,-1,-1,-1,-1,-1,-1,-1,-1,-1,-1,-1,-1,-1,-1,-1,-1,-1,-1,-1,-1,-1,-1,-1,-1,-1,-1,-1,-1,-1,-1,-1,-1,-1,-1,-1,-1,-1,-1,-1,-1,-1,-1,-1,-1,-1,-1,-1,-1,-1,-1,-1,-1,-1,-1,-1,-1,-1,-1,-1,-1,-1,-1,-1,-1,-1,-1,-1,-1,-1,-1,-1,-1,-1,-1,-1,-1,-1,-1,-1,-1,-1,-1,-1,-1,-1,-1,-1,-1,-1,-1,-1,-1,-1,-1,-1,-1,-1,-1,-1,-1,-1,-1,-1,-1,-1,-1,-1,-1,-1,-1,-1,-1,-1,-1,-1,-1,-1,-1,-1,-1,-1,-1,-1,-1,-1,-1,-1,-1,-1,-1,-1,-1,-1,-1,-1,-1,-1,-1,-1,-1,-1,-1,-1,-1,-1,-1,-1,-1,-1,-1,-1,-1,-1,-1,-1,-1,-1,-1,-1,-1,-1,-1,-1,-1,-1,-1,-1,-1,-1,-1,-1,-1,-1,-1,-1,-1,-1,-1,-1,-1,-1,-1,-1,-1,-1,-1,-1,-1,-1,-1,-1,-1,-1,-1,-1,-1,-1,-1,-1,-1,-1,-1,-1,-1,-1,-1,-1,-1,-1,-1,-1,-1,-1,-1,-1,-1,-1,-1,-1,-1,-1,-1,-1,-1,-1,-1,-1,-1,-1,-1,-1,-1,-1,-1,-1,-1,-1,-1,-1,-1,-1,-1,-1,-1,-1,-1,-1,-1,-1,-1,-1,-1,-1,-1,-1,-1,-1,-1,-1,-1,-1,-1,-1,-1,-1,-1,-1,-1,-1,-1,-1,-1,-1,-1,-1,-1,-1,-1,-1,-1,-1,-1,-1,-1,-1,-1,-1,-1,-1,-1,-1,-1,-1,-1,-1,-1,-1,-1,-1,-1,-1,-1,-1,-1,-1,-1,-1,-1,-1,-1,-1,-1,-1,-1,-1,-1,-1,-1,-1,-1,-1,-1,-1,-1,-1,-1,-1,-1,-1,-1,-1,-1,-1,-1,-1,-1,-1,-1,-1,-1,-1,-1,-1,-1,-1,-1,-1,-1,-1,-1,-1,-1,-1,-1,-1,-1,-1,-1,-1,-1,-1,-1,-1,-1,-1,-1,-1,-1,-1,-1,-1,-1,-1,-1,-1,-1,-1,-1,-1,-1,-1,-1,-1,-1,-1,-1,-1,-1,-1,-1,-1,-1,-1,-1,-1,-1,-1,-1,-1,-1,-1,-1,-1,-1,-1,-1,-1,-1,-1,-1,-1,-1,-1,-1,-1,-1,-1,-1,-1,-1,-1,-1,-1,-1,-1,-1,-1,-1,-1,-1,-1,-1,-1,-1,-1,-1,-1,-1,-1,-1,-1,-1,-1,-1,-1,-1,-1,-1,-1,-1,-1,-1,-1,-1,-1,-1,-1,-1,-1,-1,-1,-1,-1,-1,-1,-1,-1,-1,-1,-1,-1,-1,-1,-1,-1,-1,-1,-1,-1,-1,-1,-1,-1,-1,-1,-1,-1,-1,-1,-1,-1,-1,-1,-1,-1,-1,-1,-1,-1,-1,-1,-1,-1,-1,-1,-1,-1,-1,-1,-1,-1,-1,-1,-1,-1,-1,-1,-1,-1,-1,-1,-1,-1,-1,-1,-1,-1,-1,-1,-1,-1,-1,-1,-1,-1,-1,-1,-1,-1,-1,-1,-1,-1,-1,-1,-1,-1,-1,-1,-1,-1,-1,-1,-1,-1,-1,-1,-1,-1,-1,-1,-1,-1,-1,-1,-1,-1,-1,-1,-1,-1,-1,-1,-1,-1,-1,-1,-1,-1,-1,-1,-1,-1,-1,-1,-1,-1,-1,-1,-1,-1,-1,-1,-1,-1,-1,-1,-1,-1,-1,-1,-1,-1,-1,-1,-1,-1,-1,-1,-1,-1,-1,-1,-1,-1,-1,-1,-1,-1,-1,-1,-1,-1,-1,-1,-1,-1,-1,-1,-1,-1,-1,-1,-1,-1,-1,-1,-1,-1,-1,-1,-1,-1,-1,-1,-1,-1,-1,-1,-1,-1,-1,-1,-1,-1,-1,-1,-1,-1,-1,-1,-1,-1
10.0.0.2,0,1,0,0,0,1,0,1,0,0,0,0,0,0,0,0,0,0,0,0,0,0,0,0,0,1,0,1,0,1,0,0,0,0,0,1,0,0,1,1,1,1,0,1,1,1,0,0,0,1,0,0,0,0,0,0,0,0,0,0,0,0,0,0,0,1,0,0,0,0,0,0,0,0,0,0,0,0,0,1,0,0,0,1,0,0,1,0,1,1,0,0,1,0,1,1,0,0,0,0,1,0,1,0,0,0,0,0,0,0,0,0,0,0,0,0,0,0,0,0,0,0,0,0,0,0,1,0,0,0,0,0,1,0,1,0,0,0,0,0,0,0,0,0,0,0,0,0,0,0,0,0,0,0,0,0,0,0,0,1,-1,-1,-1,-1,-1,-1,-1,-1,-1,-1,-1,-1,-1,-1,-1,-1,-1,-1,-1,-1,-1,-1,-1,-1,-1,-1,-1,-1,-1,-1,-1,-1,-1,-1,-1,-1,-1,-1,-1,-1,-1,-1,-1,-1,-1,-1,-1,-1,-1,-1,-1,-1,-1,-1,-1,-1,-1,-1,-1,-1,-1,-1,-1,-1,-1,-1,-1,-1,-1,-1,-1,-1,-1,-1,-1,-1,-1,-1,-1,-1,-1,-1,-1,-1,-1,-1,-1,-1,-1,-1,-1,-1,-1,-1,-1,-1,-1,-1,-1,-1,-1,-1,-1,-1,-1,-1,-1,-1,-1,-1,-1,-1,-1,-1,-1,-1,-1,-1,-1,-1,-1,-1,-1,-1,-1,-1,-1,-1,-1,-1,-1,-1,-1,-1,-1,-1,-1,-1,-1,-1,-1,-1,-1,-1,-1,-1,-1,-1,-1,-1,-1,-1,-1,-1,-1,-1,-1,-1,-1,-1,-1,-1,-1,-1,-1,-1,-1,-1,-1,-1,-1,-1,-1,-1,-1,-1,-1,-1,-1,-1,-1,-1,-1,-1,-1,-1,-1,-1,-1,-1,-1,-1,-1,-1,-1,-1,-1,-1,-1,-1,-1,-1,-1,-1,-1,-1,-1,-1,-1,-1,-1,-1,-1,-1,-1,-1,-1,-1,-1,-1,-1,-1,-1,-1,-1,-1,-1,-1,-1,-1,-1,-1,-1,-1,-1,-1,-1,-1,-1,-1,-1,-1,-1,-1,-1,-1,-1,-1,-1,-1,-1,-1,-1,-1,-1,-1,-1,-1,-1,-1,-1,-1,-1,-1,-1,-1,-1,-1,-1,-1,-1,-1,-1,-1,-1,-1,-1,-1,-1,-1,-1,-1,-1,-1,-1,-1,-1,-1,-1,-1,-1,-1,-1,-1,-1,-1,-1,-1,-1,-1,-1,-1,-1,-1,-1,-1,-1,-1,-1,-1,-1,-1,-1,-1,-1,-1,-1,-1,-1,-1,-1,-1,-1,-1,-1,-1,-1,-1,-1,-1,-1,-1,-1,-1,-1,-1,-1,-1,-1,-1,-1,-1,-1,-1,-1,-1,-1,-1,-1,-1,-1,-1,-1,-1,-1,-1,-1,-1,-1,-1,-1,-1,-1,-1,-1,-1,-1,-1,-1,-1,-1,-1,-1,-1,-1,-1,-1,-1,-1,-1,-1,-1,-1,-1,-1,-1,-1,-1,-1,-1,-1,-1,-1,-1,-1,-1,-1,-1,-1,-1,-1,-1,-1,-1,-1,-1,-1,-1,-1,-1,-1,-1,-1,-1,-1,-1,-1,-1,-1,-1,-1,-1,-1,-1,-1,-1,-1,-1,-1,-1,-1,-1,-1,-1,-1,-1,-1,-1,-1,-1,-1,-1,-1,-1,-1,-1,-1,-1,-1,-1,-1,-1,-1,-1,-1,-1,-1,-1,-1,-1,-1,-1,-1,-1,-1,-1,-1,-1,-1,-1,-1,-1,-1,-1,-1,-1,-1,-1,-1,-1,-1,-1,-1,-1,-1,-1,-1,-1,-1,-1,-1,-1,-1,-1,-1,-1,-1,-1,-1,-1,-1,-1,-1,-1,-1,-1,-1,-1,-1,-1,-1,-1,-1,-1,-1,-1,-1,-1,-1,-1,-1,-1,-1,-1,-1,-1,-1,-1,-1,-1,-1,-1,-1,-1,-1,-1,-1,-1,-1,-1,-1,-1,-1,-1,-1,-1,-1,-1,-1,-1,-1,-1,-1,-1,-1,-1,-1,-1,-1,-1,-1,-1,-1,-1,-1,-1,-1,-1,-1,-1,-1,-1,-1,-1,-1,-1,-1,-1,-1,-1,-1,-1,-1,-1,-1,-1,-1,-1,-1,-1,-1,-1,-1,-1,-1,-1,-1,-1,-1,-1,-1,-1,-1,-1,-1,-1,-1,-1,-1,-1,-1,-1,-1,-1,-1,-1,-1,-1,-1,-1,-1,-1,-1,-1,-1,-1,-1,-1,-1,-1,-1,-1,-1,-1,-1,-1,-1,-1,-1,-1,-1,-1,-1,-1,-1,-1,-1,-1,-1,-1,-1,-1,-1,-1,-1,-1,-1,-1,-1,-1,-1,-1,-1,-1,-1,-1,-1,-1,-1,-1,-1,-1,-1,-1,-1,-1,-1,-1,-1,-1,-1,-1,-1,-1,-1,-1,-1,-1,-1,-1,-1,-1,-1,-1,-1,-1,-1,-1,-1,-1,-1,-1,-1,-1,-1,-1,-1,-1,-1,-1,-1,-1,-1,-1,-1,-1,-1,-1,-1,-1,-1,-1,-1,-1,-1,-1,-1,-1,-1,-1,-1,-1,-1,-1,-1,-1,-1,-1,-1,-1,-1,-1,-1,-1,-1,-1,-1,-1,-1,-1,-1,-1,-1,-1,-1,-1,-1,-1,-1,-1,-1,-1,-1,-1,-1,-1,-1,-1,-1,-1,-1,-1,-1,-1,-1,-1,-1,-1,-1,-1,-1,-1,-1,-1,-1,-1,-1,-1,-1,-1,-1,-1,-1,-1,-1,-1,-1,-1,-1,-1
10.0.0.1,0,1,0,0,0,1,0,1,0,0,0,0,0,0,0,0,0,0,0,0,0,0,0,0,0,1,0,1,0,1,0,0,1,0,1,1,1,1,1,0,1,1,1,0,0,1,1,0,0,0,0,0,0,0,0,0,0,0,0,0,0,0,0,0,0,1,0,0,0,0,0,0,0,0,0,0,0,0,0,1,1,0,1,0,0,1,1,1,1,1,0,0,0,0,0,0,0,0,0,0,1,0,1,0,0,0,0,0,0,0,0,0,0,0,0,0,0,0,0,0,0,0,0,0,0,0,0,1,0,0,0,0,1,0,1,0,0,0,0,0,0,0,0,0,0,0,0,0,0,0,0,0,0,0,0,0,0,0,1,0,-1,-1,-1,-1,-1,-1,-1,-1,-1,-1,-1,-1,-1,-1,-1,-1,-1,-1,-1,-1,-1,-1,-1,-1,-1,-1,-1,-1,-1,-1,-1,-1,-1,-1,-1,-1,-1,-1,-1,-1,-1,-1,-1,-1,-1,-1,-1,-1,-1,-1,-1,-1,-1,-1,-1,-1,-1,-1,-1,-1,-1,-1,-1,-1,-1,-1,-1,-1,-1,-1,-1,-1,-1,-1,-1,-1,-1,-1,-1,-1,-1,-1,-1,-1,-1,-1,-1,-1,-1,-1,-1,-1,-1,-1,-1,-1,-1,-1,-1,-1,-1,-1,-1,-1,-1,-1,-1,-1,-1,-1,-1,-1,-1,-1,-1,-1,-1,-1,-1,-1,-1,-1,-1,-1,-1,-1,-1,-1,-1,-1,-1,-1,-1,-1,-1,-1,-1,-1,-1,-1,-1,-1,-1,-1,-1,-1,-1,-1,-1,-1,-1,-1,-1,-1,-1,-1,-1,-1,-1,-1,-1,-1,-1,-1,-1,-1,-1,-1,-1,-1,-1,-1,-1,-1,-1,-1,-1,-1,-1,-1,-1,-1,-1,-1,-1,-1,-1,-1,-1,-1,-1,-1,-1,-1,-1,-1,-1,-1,-1,-1,-1,-1,-1,-1,-1,-1,-1,-1,-1,-1,-1,-1,-1,-1,-1,-1,-1,-1,-1,-1,-1,-1,-1,-1,-1,-1,-1,-1,-1,-1,-1,-1,-1,-1,-1,-1,-1,-1,-1,-1,-1,-1,-1,-1,-1,-1,-1,-1,-1,-1,-1,-1,-1,-1,-1,-1,-1,-1,-1,-1,-1,-1,-1,-1,-1,-1,-1,-1,-1,-1,-1,-1,-1,-1,-1,-1,-1,-1,-1,-1,-1,-1,-1,-1,-1,-1,-1,-1,-1,-1,-1,-1,-1,-1,-1,-1,-1,-1,-1,-1,-1,-1,-1,-1,-1,-1,-1,-1,-1,-1,-1,-1,-1,-1,-1,-1,-1,-1,-1,-1,-1,-1,-1,-1,-1,-1,-1,-1,-1,-1,-1,-1,-1,-1,-1,-1,-1,-1,-1,-1,-1,-1,-1,-1,-1,-1,-1,-1,-1,-1,-1,-1,-1,-1,-1,-1,-1,-1,-1,-1,-1,-1,-1,-1,-1,-1,-1,-1,-1,-1,-1,-1,-1,-1,-1,-1,-1,-1,-1,-1,-1,-1,-1,-1,-1,-1,-1,-1,-1,-1,-1,-1,-1,-1,-1,-1,-1,-1,-1,-1,-1,-1,-1,-1,-1,-1,-1,-1,-1,-1,-1,-1,-1,-1,-1,-1,-1,-1,-1,-1,-1,-1,-1,-1,-1,-1,-1,-1,-1,-1,-1,-1,-1,-1,-1,-1,-1,-1,-1,-1,-1,-1,-1,-1,-1,-1,-1,-1,-1,-1,-1,-1,-1,-1,-1,-1,-1,-1,-1,-1,-1,-1,-1,-1,-1,-1,-1,-1,-1,-1,-1,-1,-1,-1,-1,-1,-1,-1,-1,-1,-1,-1,-1,-1,-1,-1,-1,-1,-1,-1,-1,-1,-1,-1,-1,-1,-1,-1,-1,-1,-1,-1,-1,-1,-1,-1,-1,-1,-1,-1,-1,-1,-1,-1,-1,-1,-1,-1,-1,-1,-1,-1,-1,-1,-1,-1,-1,-1,-1,-1,-1,-1,-1,-1,-1,-1,-1,-1,-1,-1,-1,-1,-1,-1,-1,-1,-1,-1,-1,-1,-1,-1,-1,-1,-1,-1,-1,-1,-1,-1,-1,-1,-1,-1,-1,-1,-1,-1,-1,-1,-1,-1,-1,-1,-1,-1,-1,-1,-1,-1,-1,-1,-1,-1,-1,-1,-1,-1,-1,-1,-1,-1,-1,-1,-1,-1,-1,-1,-1,-1,-1,-1,-1,-1,-1,-1,-1,-1,-1,-1,-1,-1,-1,-1,-1,-1,-1,-1,-1,-1,-1,-1,-1,-1,-1,-1,-1,-1,-1,-1,-1,-1,-1,-1,-1,-1,-1,-1,-1,-1,-1,-1,-1,-1,-1,-1,-1,-1,-1,-1,-1,-1,-1,-1,-1,-1,-1,-1,-1,-1,-1,-1,-1,-1,-1,-1,-1,-1,-1,-1,-1,-1,-1,-1,-1,-1,-1,-1,-1,-1,-1,-1,-1,-1,-1,-1,-1,-1,-1,-1,-1,-1,-1,-1,-1,-1,-1,-1,-1,-1,-1,-1,-1,-1,-1,-1,-1,-1,-1,-1,-1,-1,-1,-1,-1,-1,-1,-1,-1,-1,-1,-1,-1,-1,-1,-1,-1,-1,-1,-1,-1,-1,-1,-1,-1,-1,-1,-1,-1,-1,-1,-1,-1,-1,-1,-1,-1,-1,-1,-1,-1,-1,-1,-1,-1,-1,-1,-1,-1,-1,-1,-1,-1,-1,-1,-1,-1,-1,-1,-1,-1,-1,-1,-1,-1,-1,-1,-1,-1,-1,-1,-1,-1,-1,-1,-1,-1,-1,-1,-1,-1,-1,-1,-1,-1,-1,-1,-1,-1,-1
10.0.0.2,0,1,0,0,0,1,0,1,0,0,0,0,0,0,0,0,0,0,0,0,0,0,0,0,0,1,0,1,0,1,0,0,0,0,0,1,0,1,0,0,0,1,0,1,1,1,1,0,0,1,0,0,0,0,0,0,0,0,0,0,0,0,0,0,0,1,0,0,0,0,0,0,0,0,0,0,0,0,0,1,0,0,0,1,0,0,1,0,0,1,0,0,1,0,0,1,0,0,0,0,1,0,1,0,0,0,0,0,0,0,0,0,0,0,0,0,0,0,0,0,0,0,0,0,0,0,1,0,0,0,0,0,1,0,1,0,0,0,0,0,0,0,0,0,0,0,0,0,0,0,0,0,0,0,0,0,0,0,0,1,-1,-1,-1,-1,-1,-1,-1,-1,-1,-1,-1,-1,-1,-1,-1,-1,-1,-1,-1,-1,-1,-1,-1,-1,-1,-1,-1,-1,-1,-1,-1,-1,-1,-1,-1,-1,-1,-1,-1,-1,-1,-1,-1,-1,-1,-1,-1,-1,-1,-1,-1,-1,-1,-1,-1,-1,-1,-1,-1,-1,-1,-1,-1,-1,-1,-1,-1,-1,-1,-1,-1,-1,-1,-1,-1,-1,-1,-1,-1,-1,-1,-1,-1,-1,-1,-1,-1,-1,-1,-1,-1,-1,-1,-1,-1,-1,-1,-1,-1,-1,-1,-1,-1,-1,-1,-1,-1,-1,-1,-1,-1,-1,-1,-1,-1,-1,-1,-1,-1,-1,-1,-1,-1,-1,-1,-1,-1,-1,-1,-1,-1,-1,-1,-1,-1,-1,-1,-1,-1,-1,-1,-1,-1,-1,-1,-1,-1,-1,-1,-1,-1,-1,-1,-1,-1,-1,-1,-1,-1,-1,-1,-1,-1,-1,-1,-1,-1,-1,-1,-1,-1,-1,-1,-1,-1,-1,-1,-1,-1,-1,-1,-1,-1,-1,-1,-1,-1,-1,-1,-1,-1,-1,-1,-1,-1,-1,-1,-1,-1,-1,-1,-1,-1,-1,-1,-1,-1,-1,-1,-1,-1,-1,-1,-1,-1,-1,-1,-1,-1,-1,-1,-1,-1,-1,-1,-1,-1,-1,-1,-1,-1,-1,-1,-1,-1,-1,-1,-1,-1,-1,-1,-1,-1,-1,-1,-1,-1,-1,-1,-1,-1,-1,-1,-1,-1,-1,-1,-1,-1,-1,-1,-1,-1,-1,-1,-1,-1,-1,-1,-1,-1,-1,-1,-1,-1,-1,-1,-1,-1,-1,-1,-1,-1,-1,-1,-1,-1,-1,-1,-1,-1,-1,-1,-1,-1,-1,-1,-1,-1,-1,-1,-1,-1,-1,-1,-1,-1,-1,-1,-1,-1,-1,-1,-1,-1,-1,-1,-1,-1,-1,-1,-1,-1,-1,-1,-1,-1,-1,-1,-1,-1,-1,-1,-1,-1,-1,-1,-1,-1,-1,-1,-1,-1,-1,-1,-1,-1,-1,-1,-1,-1,-1,-1,-1,-1,-1,-1,-1,-1,-1,-1,-1,-1,-1,-1,-1,-1,-1,-1,-1,-1,-1,-1,-1,-1,-1,-1,-1,-1,-1,-1,-1,-1,-1,-1,-1,-1,-1,-1,-1,-1,-1,-1,-1,-1,-1,-1,-1,-1,-1,-1,-1,-1,-1,-1,-1,-1,-1,-1,-1,-1,-1,-1,-1,-1,-1,-1,-1,-1,-1,-1,-1,-1,-1,-1,-1,-1,-1,-1,-1,-1,-1,-1,-1,-1,-1,-1,-1,-1,-1,-1,-1,-1,-1,-1,-1,-1,-1,-1,-1,-1,-1,-1,-1,-1,-1,-1,-1,-1,-1,-1,-1,-1,-1,-1,-1,-1,-1,-1,-1,-1,-1,-1,-1,-1,-1,-1,-1,-1,-1,-1,-1,-1,-1,-1,-1,-1,-1,-1,-1,-1,-1,-1,-1,-1,-1,-1,-1,-1,-1,-1,-1,-1,-1,-1,-1,-1,-1,-1,-1,-1,-1,-1,-1,-1,-1,-1,-1,-1,-1,-1,-1,-1,-1,-1,-1,-1,-1,-1,-1,-1,-1,-1,-1,-1,-1,-1,-1,-1,-1,-1,-1,-1,-1,-1,-1,-1,-1,-1,-1,-1,-1,-1,-1,-1,-1,-1,-1,-1,-1,-1,-1,-1,-1,-1,-1,-1,-1,-1,-1,-1,-1,-1,-1,-1,-1,-1,-1,-1,-1,-1,-1,-1,-1,-1,-1,-1,-1,-1,-1,-1,-1,-1,-1,-1,-1,-1,-1,-1,-1,-1,-1,-1,-1,-1,-1,-1,-1,-1,-1,-1,-1,-1,-1,-1,-1,-1,-1,-1,-1,-1,-1,-1,-1,-1,-1,-1,-1,-1,-1,-1,-1,-1,-1,-1,-1,-1,-1,-1,-1,-1,-1,-1,-1,-1,-1,-1,-1,-1,-1,-1,-1,-1,-1,-1,-1,-1,-1,-1,-1,-1,-1,-1,-1,-1,-1,-1,-1,-1,-1,-1,-1,-1,-1,-1,-1,-1,-1,-1,-1,-1,-1,-1,-1,-1,-1,-1,-1,-1,-1,-1,-1,-1,-1,-1,-1,-1,-1,-1,-1,-1,-1,-1,-1,-1,-1,-1,-1,-1,-1,-1,-1,-1,-1,-1,-1,-1,-1,-1,-1,-1,-1,-1,-1,-1,-1,-1,-1,-1,-1,-1,-1,-1,-1,-1,-1,-1,-1,-1,-1,-1,-1,-1,-1,-1,-1,-1,-1,-1,-1,-1,-1,-1,-1,-1,-1,-1,-1,-1,-1,-1,-1,-1,-1,-1,-1,-1,-1,-1,-1,-1,-1,-1,-1,-1,-1,-1,-1,-1,-1,-1,-1,-1,-1,-1,-1,-1,-1,-1,-1,-1,-1,-1,-1,-1,-1,-1,-1,-1,-1
10.0.0.1,0,1,0,0,0,1,0,1,0,0,0,0,0,0,0,0,0,0,0,0,0,0,0,0,0,1,0,1,0,1,0,0,1,0,1,1,1,1,1,1,0,1,0,0,0,1,0,1,0,0,0,0,0,0,0,0,0,0,0,0,0,0,0,0,0,1,0,0,0,0,0,0,0,0,0,0,0,0,0,1,1,0,1,0,0,1,1,1,0,1,1,0,0,0,0,1,0,0,0,0,1,0,1,0,0,0,0,0,0,0,0,0,0,0,0,0,0,0,0,0,0,0,0,0,0,0,0,1,0,0,0,0,1,0,1,0,0,0,0,0,0,0,0,0,0,0,0,0,0,0,0,0,0,0,0,0,0,0,1,0,-1,-1,-1,-1,-1,-1,-1,-1,-1,-1,-1,-1,-1,-1,-1,-1,-1,-1,-1,-1,-1,-1,-1,-1,-1,-1,-1,-1,-1,-1,-1,-1,-1,-1,-1,-1,-1,-1,-1,-1,-1,-1,-1,-1,-1,-1,-1,-1,-1,-1,-1,-1,-1,-1,-1,-1,-1,-1,-1,-1,-1,-1,-1,-1,-1,-1,-1,-1,-1,-1,-1,-1,-1,-1,-1,-1,-1,-1,-1,-1,-1,-1,-1,-1,-1,-1,-1,-1,-1,-1,-1,-1,-1,-1,-1,-1,-1,-1,-1,-1,-1,-1,-1,-1,-1,-1,-1,-1,-1,-1,-1,-1,-1,-1,-1,-1,-1,-1,-1,-1,-1,-1,-1,-1,-1,-1,-1,-1,-1,-1,-1,-1,-1,-1,-1,-1,-1,-1,-1,-1,-1,-1,-1,-1,-1,-1,-1,-1,-1,-1,-1,-1,-1,-1,-1,-1,-1,-1,-1,-1,-1,-1,-1,-1,-1,-1,-1,-1,-1,-1,-1,-1,-1,-1,-1,-1,-1,-1,-1,-1,-1,-1,-1,-1,-1,-1,-1,-1,-1,-1,-1,-1,-1,-1,-1,-1,-1,-1,-1,-1,-1,-1,-1,-1,-1,-1,-1,-1,-1,-1,-1,-1,-1,-1,-1,-1,-1,-1,-1,-1,-1,-1,-1,-1,-1,-1,-1,-1,-1,-1,-1,-1,-1,-1,-1,-1,-1,-1,-1,-1,-1,-1,-1,-1,-1,-1,-1,-1,-1,-1,-1,-1,-1,-1,-1,-1,-1,-1,-1,-1,-1,-1,-1,-1,-1,-1,-1,-1,-1,-1,-1,-1,-1,-1,-1,-1,-1,-1,-1,-1,-1,-1,-1,-1,-1,-1,-1,-1,-1,-1,-1,-1,-1,-1,-1,-1,-1,-1,-1,-1,-1,-1,-1,-1,-1,-1,-1,-1,-1,-1,-1,-1,-1,-1,-1,-1,-1,-1,-1,-1,-1,-1,-1,-1,-1,-1,-1,-1,-1,-1,-1,-1,-1,-1,-1,-1,-1,-1,-1,-1,-1,-1,-1,-1,-1,-1,-1,-1,-1,-1,-1,-1,-1,-1,-1,-1,-1,-1,-1,-1,-1,-1,-1,-1,-1,-1,-1,-1,-1,-1,-1,-1,-1,-1,-1,-1,-1,-1,-1,-1,-1,-1,-1,-1,-1,-1,-1,-1,-1,-1,-1,-1,-1,-1,-1,-1,-1,-1,-1,-1,-1,-1,-1,-1,-1,-1,-1,-1,-1,-1,-1,-1,-1,-1,-1,-1,-1,-1,-1,-1,-1,-1,-1,-1,-1,-1,-1,-1,-1,-1,-1,-1,-1,-1,-1,-1,-1,-1,-1,-1,-1,-1,-1,-1,-1,-1,-1,-1,-1,-1,-1,-1,-1,-1,-1,-1,-1,-1,-1,-1,-1,-1,-1,-1,-1,-1,-1,-1,-1,-1,-1,-1,-1,-1,-1,-1,-1,-1,-1,-1,-1,-1,-1,-1,-1,-1,-1,-1,-1,-1,-1,-1,-1,-1,-1,-1,-1,-1,-1,-1,-1,-1,-1,-1,-1,-1,-1,-1,-1,-1,-1,-1,-1,-1,-1,-1,-1,-1,-1,-1,-1,-1,-1,-1,-1,-1,-1,-1,-1,-1,-1,-1,-1,-1,-1,-1,-1,-1,-1,-1,-1,-1,-1,-1,-1,-1,-1,-1,-1,-1,-1,-1,-1,-1,-1,-1,-1,-1,-1,-1,-1,-1,-1,-1,-1,-1,-1,-1,-1,-1,-1,-1,-1,-1,-1,-1,-1,-1,-1,-1,-1,-1,-1,-1,-1,-1,-1,-1,-1,-1,-1,-1,-1,-1,-1,-1,-1,-1,-1,-1,-1,-1,-1,-1,-1,-1,-1,-1,-1,-1,-1,-1,-1,-1,-1,-1,-1,-1,-1,-1,-1,-1,-1,-1,-1,-1,-1,-1,-1,-1,-1
```

**Comment by JordanHolland** [comment]
I put the above nPrint in a file `nprint-bug.npt`, and ran

`$ nprint -N nprint-bug.npt -w nprint-bug-rebuilt.pcap`

tcpdump on the resulting PCAP shows:

`$ tcpdump -r nprint-bug-pcap.pcap -nn`

```
-4:00:00.000000 IP 10.0.0.2 > 10.0.0.1: ICMP echo reply, id 57629, seq 0, length 64
-4:00:00.000000 IP 10.0.0.1 > 10.0.0.2: ICMP echo reply, id 49436, seq 0, length 64
-4:00:00.000000 IP 10.0.0.2 > 10.0.0.1: ICMP echo reply, id 41244, seq 0, length 64
-4:00:00.000000 IP 10.0.0.1 > 10.0.0.2: ICMP echo reply, id 33052, seq 0, length 64
-4:00:00.000000 IP 10.0.0.2 > 10.0.0.1: ICMP echo reply, id 24860, seq 0, length 64
-4:00:00.000000 IP 10.0.0.1 > 10.0.0.2: ICMP echo reply, id 16668, seq 0, length 64
-4:00:00.000000 IP 10.0.0.2 > 10.0.0.1: ICMP echo reply, id 8476, seq 0, length 64
-4:00:00.000000 IP 10.0.0.1 > 10.0.0.2: ICMP echo reply, id 284, seq 0, length 64
```

A few questions:
1. You said the above nPrint was generated running: `nprint -i -w test.npt -f icmp`. However, nPrint only prints headers that are included in the flagset given: `nprint -i` should print the following on the first line:
```
ip,icmp_type_0,icmp_type_1,icmp_type_2,icmp_type_3,icmp_type_4,icmp_type_5,icmp_type_6,icmp_type_7,icmp_code_0,icmp_code_1,icmp_code_2,icmp_code_3,icmp_code_4,icmp_code_5,icmp_code_6,icmp_code_7,icmp_cksum_0,icmp_cksum_1,icmp_cksum_2,icmp_cksum_3,icmp_cksum_4,icmp_cksum_5,icmp_cksum_6,icmp_cksum_7,icmp_cksum_8,icmp_cksum_9,icmp_cksum_10,icmp_cksum_11,icmp_cksum_12,icmp_cksum_13,icmp_cksum_14,icmp_cksum_15,icmp_roh_0,icmp_roh_1,icmp_roh_2,icmp_roh_3,icmp_roh_4,icmp_roh_5,icmp_roh_6,icmp_roh_7,icmp_roh_8,icmp_roh_9,icmp_roh_10,icmp_roh_11,icmp_roh_12,icmp_roh_13,icmp_roh_14,icmp_roh_15,icmp_roh_16,icmp_roh_17,icmp_roh_18,icmp_roh_19,icmp_roh_20,icmp_roh_21,icmp_roh_22,icmp_roh_23,icmp_roh_24,icmp_roh_25,icmp_roh_26,icmp_roh_27,icmp_roh_28,icmp_roh_29,icmp_roh_30,icmp_roh_31
```

is this the case?

2. what version of libpcap are you running? I don't believe this should be an issue, but trying to cover all bases here. Thanks for your help!

**Comment by ramonfontes** [comment]
I just rerun `nprint -N traffic.npt -w rebuilt-traffic.pcap` and it worked. I can generate the `pcap` file with all the packets there - I don't know what happened. Anyway thanks for your help.

_Suggestion_: you could report an error when the `nprint` file does not exist. It seems that the command ignores the nonexistent file and it generates an empty pcap file.

**Comment by JordanHolland** [comment]
Awesome, glad it worked. We probably need to implement better error / reporting to users in general, thanks for the suggestion.

**Comment by cmarkle85** [comment]
I'm not entirely sure if this is related to the original poster's issue but the title is appropriate for my issue.

Reverting an nPrint back to a PCAP is having some weird behavior on my system. Throughout I'm using port80.pcap from the example folder in this repo.

Generate nprint using:
```
~$ nprint -P port80.pcap -4 -W port80.npt
```
Reconstruct using:
```
~$ nprint -N port80.npt -W port80_2.pcap
Segmentation fault (core dumped)
```
Inspecting resultant file sizes:
```
~$ ls -lh
** 580K Oct  3 11:52 port80_2.pcap
** 3.0M Oct  3 11:51 port80.npt
** 1.8M Oct  3 11:16 port80.pcap
```
** = omitted

Counting the number of packets in port80_2.pcap:
```
~$ tshark -r port80_2.pcap | wc -l
tshark: The file "port80_2.pcap" appears to have been cut short in the middle of a packet.
787
```
If I create the nPrint using a different set of flags the behavior changes.
```
~$ nprint -P port80.pcap -4 -e -t -W port80.npt
~$ nprint -N port80.npt -W port80_2.pcap
~$ ls -lh
** 6.3M Oct  3 12:03 port80.npt
** 1.8M Oct  3 11:16 port80.pcap
**     24 Oct  3 12:03 port80_2.pcap
```
Note, the reconstruct command no longer results in a Segmentation Fault but the resultant pcap is empty.

I have tried executing all commands with and without 'sudo'. I have tried executing them within a docker container (Ubuntu 18.04) and directly on the host (Ubuntu 20.04). I have tried using other pcap files and still observe similar behavior (some combination of flags will result in Segmentation Fault and some other combination will result in an empty pcap). I haven't found a combination of flags that results in the expected behavior.

I'm using nPrint version 1.2.0. I'm using libpcap-dev version 1.9.1-3.

**Comment by JordanHolland** [comment]
Thanks for the detailed error report regarding recreating pcaps from nPrints. As you can imagine, this functionality is a bit tricky to actually implement, so I'm not shocked that we're finding bugs here. I will look into fixing this for the `port80.pcap`.

**Comment by JordanHolland** [comment]
Interestingly, I'm not having this issue on Mac OS

```
$tcpdump --version
tcpdump version tcpdump version 4.9.3 -- Apple version 100
libpcap version 1.9.1
LibreSSL 2.8.3

$nprint --version
nprint 1.2.0

$tshark --version
TShark (Wireshark) 3.4.8 (v3.4.8-0-g3e1ffae201b8)
```

`~$ nprint -P port80.pcap -4 -W port80.npt`

`~$ nprint -N port80.npt -W port80_2.pcap`

```
$ ls -lh
** 3.0M Oct  6 10:18 port80.npt
** 1.7M Oct  6 10:18 port80.pcap
** 1.7M Oct  6 10:19 port80_2.pcap
```

```
$ tcpdump -r port80_2.pcap -c 3
reading from file port80_2.pcap, link-type RAW (Raw IP)
-4:00:00.000000 IP 243.186.23.169.0 > 14-245-95.guest.wireless.msu.edu.16:  tcp 20 [bad hdr length 0 - too short, < 20]
-4:00:00.000000 IP 14-245-95.guest.wireless.msu.edu.12336 > 243.186.23.169.12336:  tcp 20 [bad hdr length 0 - too short, < 20]
-4:00:00.000000 IP 243.186.23.169.12336 > 238.4.62.5.12336:  tcp 20 [bad hdr length 0 - too short, < 20]
```

```
$ tshark -r port80_2.pcap -c 3
    1   0.000000 243.186.23.169 → 35.14.245.95 TCP 40 0 → 16 [<None>] Seq=1 Win=0, bogus TCP header length (0, must be at least 20)
    2   0.000000 35.14.245.95 → 243.186.23.169 TCP 40 12336 → 12336 [<None>] Seq=1 Win=0, bogus TCP header length (0, must be at least 20)
    3   0.000000 243.186.23.169 → 238.4.62.5   TCP 40 12336 → 12336 [<None>] Seq=1 Win=0, bogus TCP header length (0, must be at least 20)
```

As expected, dropping the TCP header does make `tshark` / `tcpdump` a bit unhappy, but checking again with new flags..

`nprint -P port80.pcap -4 -t -W port80.npt`

`nprint -N port80.npt -W port80_3.pcap`


```
5.7M Oct  6 10:29 port80.npt
1.7M Oct  6 10:18 port80.pcap
1.7M Oct  6 10:19 port80_2.pcap
1.7M Oct  6 10:29 port80_3.pcap
```

Original file
```
$tshark -r port80.pcap -c 3
    1   0.000000 243.186.23.169 → 35.14.245.95 TCP 54 60457 → 80 [ACK] Seq=1 Ack=1 Win=4096 Len=0
    2   0.004876 35.14.245.95 → 243.186.23.169 TCP 60 [TCP ACKed unseen segment] 80 → 60457 [ACK] Seq=1 Ack=2 Win=66 Len=0
    3   1.146506 243.186.23.169 → 238.4.62.5   TCP 54 60465 → 80 [ACK] Seq=1 Ack=1 Win=2051 Len=0
```

`port80_3.pcap`
```
$ tshark -r port80_3.pcap -c 3
    1   0.000000 243.186.23.169 → 35.14.245.95 TCP 40 60457 → 80 [ACK] Seq=1 Ack=1 Win=4096 Len=0
    2   0.000000 35.14.245.95 → 243.186.23.169 TCP 40 [TCP ACKed unseen segment] 80 → 60457 [ACK] Seq=1 Ack=2 Win=66 Len=0
    3   0.000000 243.186.23.169 → 238.4.62.5   TCP 40 60465 → 80 [ACK] Seq=1 Ack=1 Win=2051 Len=0
```

**Comment by cmarkle85** [comment]
I tried it with and without tcpdump, no change, I still get the Segmentation Faults.
```
$ tcpdump --version
tcpdump version 4.9.3
libpcap version 1.8.1
OpenSSL 1.1.1  11 Sep 2018
```

```
$ make --version
GNU Make 4.1
```

**Comment by JordanHolland** [comment]
Interesting. Possible to bump the version of `libpcap` to see if that could be an issue? It's unclear to me what could be happening between our two versions.

**Comment by cmarkle85** [comment]
No joy.
```
$ tcpdump --version
tcpdump version 4.9.3
libpcap version 1.9.1 (with TPACKET_V3)
OpenSSL 1.1.1f  31 Mar 2020
```

**Comment by cmarkle85** [comment]
Could it be that you are on a Mac? I'm not sure why that would matter but I can't think of anything else. Could you try running nPrint in a linux container?

**Comment by cmarkle85** [comment]
I can confirm that reconstructing port80.pcap on Mac works as expected.

**Comment by JordanHolland** [comment]
Thanks for the confirmation. Thinking about it, I wonder if that has to do with Linux Cooked headers (#24) and recreating a PCAP from them.

**Comment by cmarkle85** [comment]
I can confirm that this issue persists after building from source (commit e435a72).

**Comment by JordanHolland** [comment]
is this regarding this issue or #30?

**Comment by cmarkle85** [comment]
Sorry for the confusion. I'm confirming that this issue (#3) persists even if I build from source (commit e435a72).

**Comment by JordanHolland** [comment]
No problem, just wanted to make sure we are on the same page. I am not shocked that this error still persists in your environment, e435a72 should take care of #30, not #3. I will have to get on a linux box to dig into this issue.

**Comment by arielgoes** [comment]
Hello,
I'm facing the same problem.

I tried to generate a PCAP from `port80.pcap` example file - with/without `-4` and `-t`. However, there is still segmentation fault.

With `-4 -t` flags:
![image](https://github.com/user-attachments/assets/c0fc7389-280c-4711-aab5-9345e791aa1c)

With `-4` flags:
![image](https://github.com/user-attachments/assets/4522ec44-0433-4d63-a155-69a1cb8ab1f8)

It works without any flags...
![image](https://github.com/user-attachments/assets/14c97ba0-7572-4809-8ea0-e5888e88517c)

...but without any packets:
![image](https://github.com/user-attachments/assets/5bac198e-8b35-4a4f-b573-fb98935ee88a)

Environment:
```
(base) ariel@ariel-Nitro-AN515-44:~/git/nprint/example$ tcpdump --version
tcpdump version 4.99.1
libpcap version 1.10.1 (with TPACKET_V3)
OpenSSL 3.0.2 15 Mar 2022
```
```
(base) ariel@ariel-Nitro-AN515-44:~/git/nprint/example$ lsb_release -a
No LSB modules are available.
Distributor ID:	Ubuntu
Description:	Ubuntu 22.04.4 LTS
Release:	22.04
Codename:	jammy
```

**Comment by arielgoes** [comment]
Some colleagues and I implemented a [nPrint to PCAP converter](https://github.com/arielgoes/nPrint2PCAP/blob/main/README.md) that processes nPrint files as input. Not all available nPrint protocols have yet been implemented. But it is a way to escape segmentation fault problems.

It also supports some flags to calculate checksum (if needed) for IPv4, TCP and UDP, so far.

**Comment by JordanHolland** [comment]
Thank you for this link! Do you have plans to implement all protocols? We still need to get to the bottom of the issue with our codebase. Your repro will help

**Comment by arielgoes** [comment]
Hi @JordanHolland. In the future yes, but right now I am working on another part of the project on generating network packets - like in [NetDiffusion](https://github.com/noise-lab/NetDiffusion_Generator). In fact, part of the logic of the code in the link was based on it and on [Levent's approach](https://github.com/cslev/pcap_generator), but I provide a function that correct the fields without relying on a well-formated nPrint file.

However, my approach was totally based on Python (mostly Pandas) and iterrows method is pretty slow. That said, if you guys are open for pull requests, maybe in a near future it would be a great contribution for both of us :) I did not try to fix the bugs in nPrint because this is was not the most important part of the generation process.
